<?xml version="1.0" encoding="UTF-8"?>
<dataroot xmlns:od="urn:schemas-microsoft-com:officedata" xmlns:xsi="http://www.w3.org/2001/XMLSchema-instance"  xsi:noNamespaceSchemaLocation="Tpurificationlog.xsd" generated="2020-01-12T15:44:39">
<Tpurificationlog>
<ID>3</ID>
<Lab_x0020_Member_x0020_ID>2</Lab_x0020_Member_x0020_ID>
<Experiment_x0020_ID>1</Experiment_x0020_ID>
<Protein_x0020_ID>17</Protein_x0020_ID>
<Competent_x0020_Cell_x0020_ID>2</Competent_x0020_Cell_x0020_ID>
<Media_x0020_ID>2</Media_x0020_ID>
<Grow_x0020_type_x0020_ID>1</Grow_x0020_type_x0020_ID>
<Cell_x0020_disruption_x0020_ID>1</Cell_x0020_disruption_x0020_ID>
<NiNTA_x0020_elution_x0020_conc_x0020__x0028_mg_x002F_ml_x0029_>1</NiNTA_x0020_elution_x0020_conc_x0020__x0028_mg_x002F_ml_x0029_>
<SDS_x0020_ID>1</SDS_x0020_ID>
<GF_x0020_elution_x0020_conc_x0020__x0028_mg_x002F_ml_x0029_>1</GF_x0020_elution_x0020_conc_x0020__x0028_mg_x002F_ml_x0029_>
<Comments>this one changed</Comments>
</Tpurificationlog>
<Tpurificationlog>
<ID>6</ID>
<Lab_x0020_Member_x0020_ID>2</Lab_x0020_Member_x0020_ID>
<Experiment_x0020_ID>1</Experiment_x0020_ID>
<Protein_x0020_ID>11</Protein_x0020_ID>
<Competent_x0020_Cell_x0020_ID>2</Competent_x0020_Cell_x0020_ID>
<Media_x0020_ID>3</Media_x0020_ID>
<Grow_x0020_type_x0020_ID>1</Grow_x0020_type_x0020_ID>
<Cell_x0020_disruption_x0020_ID>2</Cell_x0020_disruption_x0020_ID>
<NiNTA_x0020_elution_x0020_conc_x0020__x0028_mg_x002F_ml_x0029_>1</NiNTA_x0020_elution_x0020_conc_x0020__x0028_mg_x002F_ml_x0029_>
<SDS_x0020_ID>1</SDS_x0020_ID>
<GF_x0020_elution_x0020_conc_x0020__x0028_mg_x002F_ml_x0029_>2</GF_x0020_elution_x0020_conc_x0020__x0028_mg_x002F_ml_x0029_>
<Comments>second one</Comments>
</Tpurificationlog>
<Tpurificationlog>
<ID>7</ID>
<Lab_x0020_Member_x0020_ID>2</Lab_x0020_Member_x0020_ID>
<Experiment_x0020_ID>1</Experiment_x0020_ID>
<Protein_x0020_ID>1</Protein_x0020_ID>
<Competent_x0020_Cell_x0020_ID>2</Competent_x0020_Cell_x0020_ID>
<Media_x0020_ID>2</Media_x0020_ID>
<Grow_x0020_type_x0020_ID>2</Grow_x0020_type_x0020_ID>
<Cell_x0020_disruption_x0020_ID>2</Cell_x0020_disruption_x0020_ID>
<NiNTA_x0020_elution_x0020_conc_x0020__x0028_mg_x002F_ml_x0029_>4</NiNTA_x0020_elution_x0020_conc_x0020__x0028_mg_x002F_ml_x0029_>
<SDS_x0020_ID>4</SDS_x0020_ID>
<GF_x0020_elution_x0020_conc_x0020__x0028_mg_x002F_ml_x0029_>6</GF_x0020_elution_x0020_conc_x0020__x0028_mg_x002F_ml_x0029_>
<Comments>lskdj</Comments>
</Tpurificationlog>
<Tpurificationlog>
<ID>11</ID>
<Lab_x0020_Member_x0020_ID>1</Lab_x0020_Member_x0020_ID>
<Experiment_x0020_ID>2</Experiment_x0020_ID>
<Protein_x0020_ID>2</Protein_x0020_ID>
<Competent_x0020_Cell_x0020_ID>1</Competent_x0020_Cell_x0020_ID>
<Media_x0020_ID>2</Media_x0020_ID>
<Grow_x0020_type_x0020_ID>2</Grow_x0020_type_x0020_ID>
<Cell_x0020_disruption_x0020_ID>1</Cell_x0020_disruption_x0020_ID>
<NiNTA_x0020_elution_x0020_conc_x0020__x0028_mg_x002F_ml_x0029_>1</NiNTA_x0020_elution_x0020_conc_x0020__x0028_mg_x002F_ml_x0029_>
<SDS_x0020_ID>1</SDS_x0020_ID>
<GF_x0020_elution_x0020_conc_x0020__x0028_mg_x002F_ml_x0029_>1</GF_x0020_elution_x0020_conc_x0020__x0028_mg_x002F_ml_x0029_>
<Comments>1</Comments>
</Tpurificationlog>
<Tpurificationlog>
<ID>12</ID>
<Lab_x0020_Member_x0020_ID>1</Lab_x0020_Member_x0020_ID>
<Experiment_x0020_ID>1</Experiment_x0020_ID>
<Protein_x0020_ID>2</Protein_x0020_ID>
<Competent_x0020_Cell_x0020_ID>2</Competent_x0020_Cell_x0020_ID>
<Media_x0020_ID>2</Media_x0020_ID>
<Grow_x0020_type_x0020_ID>1</Grow_x0020_type_x0020_ID>
<Cell_x0020_disruption_x0020_ID>1</Cell_x0020_disruption_x0020_ID>
<NiNTA_x0020_elution_x0020_conc_x0020__x0028_mg_x002F_ml_x0029_>1</NiNTA_x0020_elution_x0020_conc_x0020__x0028_mg_x002F_ml_x0029_>
<SDS_x0020_ID>1</SDS_x0020_ID>
<GF_x0020_elution_x0020_conc_x0020__x0028_mg_x002F_ml_x0029_>1</GF_x0020_elution_x0020_conc_x0020__x0028_mg_x002F_ml_x0029_>
<Comments>no wayâ€¦</Comments>
</Tpurificationlog>
<Tpurificationlog>
<ID>13</ID>
<Lab_x0020_Member_x0020_ID>1</Lab_x0020_Member_x0020_ID>
<Experiment_x0020_ID>3</Experiment_x0020_ID>
<Protein_x0020_ID>12</Protein_x0020_ID>
<Competent_x0020_Cell_x0020_ID>2</Competent_x0020_Cell_x0020_ID>
<Media_x0020_ID>2</Media_x0020_ID>
<Grow_x0020_type_x0020_ID>1</Grow_x0020_type_x0020_ID>
<Cell_x0020_disruption_x0020_ID>1</Cell_x0020_disruption_x0020_ID>
<NiNTA_x0020_elution_x0020_conc_x0020__x0028_mg_x002F_ml_x0029_>21</NiNTA_x0020_elution_x0020_conc_x0020__x0028_mg_x002F_ml_x0029_>
<SDS_x0020_ID>1</SDS_x0020_ID>
<GF_x0020_elution_x0020_conc_x0020__x0028_mg_x002F_ml_x0029_>1</GF_x0020_elution_x0020_conc_x0020__x0028_mg_x002F_ml_x0029_>
<Comments>sdf</Comments>
</Tpurificationlog>
<Tpurificationlog>
<ID>14</ID>
<Lab_x0020_Member_x0020_ID>1</Lab_x0020_Member_x0020_ID>
<Experiment_x0020_ID>1</Experiment_x0020_ID>
<Protein_x0020_ID>2</Protein_x0020_ID>
<Competent_x0020_Cell_x0020_ID>1</Competent_x0020_Cell_x0020_ID>
<Media_x0020_ID>2</Media_x0020_ID>
<Grow_x0020_type_x0020_ID>2</Grow_x0020_type_x0020_ID>
<Cell_x0020_disruption_x0020_ID>1</Cell_x0020_disruption_x0020_ID>
<NiNTA_x0020_elution_x0020_conc_x0020__x0028_mg_x002F_ml_x0029_>1</NiNTA_x0020_elution_x0020_conc_x0020__x0028_mg_x002F_ml_x0029_>
<SDS_x0020_ID>1</SDS_x0020_ID>
<GF_x0020_elution_x0020_conc_x0020__x0028_mg_x002F_ml_x0029_>1</GF_x0020_elution_x0020_conc_x0020__x0028_mg_x002F_ml_x0029_>
<Comments>1</Comments>
</Tpurificationlog>
<Tpurificationlog>
<ID>32</ID>
<Lab_x0020_Member_x0020_ID>0</Lab_x0020_Member_x0020_ID>
<Experiment_x0020_ID>2</Experiment_x0020_ID>
<Protein_x0020_ID>11</Protein_x0020_ID>
<Competent_x0020_Cell_x0020_ID>2</Competent_x0020_Cell_x0020_ID>
<Media_x0020_ID>1</Media_x0020_ID>
<Grow_x0020_type_x0020_ID>1</Grow_x0020_type_x0020_ID>
<Cell_x0020_disruption_x0020_ID>2</Cell_x0020_disruption_x0020_ID>
<NiNTA_x0020_elution_x0020_conc_x0020__x0028_mg_x002F_ml_x0029_>25</NiNTA_x0020_elution_x0020_conc_x0020__x0028_mg_x002F_ml_x0029_>
<SDS_x0020_ID>2</SDS_x0020_ID>
<GF_x0020_elution_x0020_conc_x0020__x0028_mg_x002F_ml_x0029_>21</GF_x0020_elution_x0020_conc_x0020__x0028_mg_x002F_ml_x0029_>
<Comments>another test</Comments>
</Tpurificationlog>
</dataroot>
